{
  "$schema": "https://raw.githubusercontent.com/xsyetopz/go-mamusiabtw/refs/heads/main/schemas/signature.schema.v1.json",
  "algorithm": "ed25519-sha256",
  "hash_b64": "RNroXYl30cIlb5kVx7RmZgmNNz7pvH36pRD9tnR0+ws=",
  "key_id": "official-release-2026-04",
  "signature_b64": "+/+FDEvwY6F1Z5T8+u1D06TD9QbO97PoBSxXE6OgsL+NMuSuhbssHwvP+sMGHmpuUFXE5Zwh3xYzTX/S4KfuAQ=="
}
