{
  "$schema": "https://raw.githubusercontent.com/xsyetopz/go-mamusiabtw/refs/heads/main/schemas/signature.schema.v1.json",
  "algorithm": "ed25519-sha256",
  "hash_b64": "MtZgG6jX8EwkD6tbf6hAFyk5EiW/Mh1QyQj0KcLY+Gw=",
  "key_id": "official-release-2026-04",
  "signature_b64": "dA4eWJohG+rApGDQfFQiRDAmWWKRSBcBYC2inaOkpHFa9XThgYbfdHh0/i+u8FSs+5HiuwRuWiPbdv5cVdDXDg=="
}
